Issue Type,Summary,Description,Priority,Story Points,Epic Link,Assignee,Labels,Sprint,Status,Component
Task,알림 설정 페이지,"가격 알림 추가/삭제, 알림 내역 조회",Low,2,Frontend - 분석 & 백테스팅,Frontend Developer Agent,ui,Sprint 5,To Do,Frontend
Story,CI/CD 파이프라인,"GitHub Actions 워크플로우, 자동 테스트, Docker 빌드, 배포",Medium,5,인프라 & 배포,DevOps Agent,cicd,Sprint 1,To Do,Infrastructure
Task,GitHub Actions 워크플로우,".github/workflows/ 설정, push/PR 트리거",High,2,CI/CD 파이프라인,DevOps Agent,github-actions,Sprint 1,To Do,Infrastructure
Task,자동 테스트 실행,"pytest (Backend), jest (Frontend) 실행, 커버리지 체크",High,1,CI/CD 파이프라인,DevOps Agent,testing,Sprint 1,To Do,Infrastructure
Task,Docker 이미지 빌드,"서비스별 이미지 빌드, 멀티 스테이지 빌드",High,2,CI/CD 파이프라인,DevOps Agent,docker,Sprint 1,To Do,Infrastructure
Task,이미지 레지스트리 푸시,"Docker Hub/GHCR에 이미지 푸시, 태깅 전략",Medium,1,CI/CD 파이프라인,DevOps Agent,registry,Sprint 1,To Do,Infrastructure
Task,배포 스크립트,"SSH로 서버 접속, docker-compose pull, 재시작",Medium,3,CI/CD 파이프라인,DevOps Agent,deployment,Sprint 1,To Do,Infrastructure
Story,모니터링 & 로깅,"구조화된 로깅, 헬스 체크, Uptime 모니터링, Sentry 에러 추적",Medium,5,인프라 & 배포,DevOps Agent,monitoring,Sprint 2,To Do,Infrastructure
Task,로깅 설정,"구조화된 로그 (JSON), 로그 레벨 관리, 로테이션",High,2,모니터링 & 로깅,DevOps Agent,logging,Sprint 2,To Do,Infrastructure
Task,헬스 체크 엔드포인트,"GET /health (Liveness), GET /ready (Readiness)",High,1,모니터링 & 로깅,DevOps Agent,health-check,Sprint 2,To Do,Infrastructure
Task,Uptime 모니터링,"UptimeRobot 설정, 다운타임 알림 (이메일/Slack)",Medium,1,모니터링 & 로깅,DevOps Agent,uptime,Sprint 2,To Do,Infrastructure
Task,에러 추적,"Sentry 통합, 에러 발생 시 알림, 스택 트레이스",High,2,모니터링 & 로깅,DevOps Agent,sentry,Sprint 2,To Do,Infrastructure
Task,로그 수집,"Docker logs → 파일 저장, Fluentd/Logstash (선택)",Low,2,모니터링 & 로깅,DevOps Agent,log-collection,Sprint 2,To Do,Infrastructure
Story,보안 강화,"HTTPS, Rate Limiting, CORS, SQL Injection/XSS 방지, 보안 헤더",High,5,인프라 & 배포,Backend Developer Agent,security,Sprint 3,To Do,Backend
Task,HTTPS 설정,"Let's Encrypt SSL 인증서, Nginx HTTPS 리다이렉트",Highest,1,보안 강화,DevOps Agent,ssl,Sprint 3,To Do,Infrastructure
Task,API Rate Limiting,"요청 제한 미들웨어 (Redis 기반), IP별 제한",High,2,보안 강화,Backend Developer Agent,rate-limiting,Sprint 3,To Do,Backend
Task,CORS 설정,"허용 도메인 관리, Preflight 처리",Medium,1,보안 강화,Backend Developer Agent,cors,Sprint 3,To Do,Backend
Task,SQL Injection 방지,"ORM 사용 검증, Prepared Statement 확인",High,1,보안 강화,Backend Developer Agent,sql-injection,Sprint 3,To Do,Backend
Task,XSS 방지,"입력 sanitization, Content-Security-Policy 헤더",High,1,보안 강화,Frontend Developer Agent,xss,Sprint 3,To Do,Frontend
Task,보안 헤더 설정,"Helmet.js, X-Frame-Options, X-Content-Type-Options 등",Medium,1,보안 강화,Backend Developer Agent,security-headers,Sprint 3,To Do,Backend
Story,백업 & 복구,"PostgreSQL 자동 백업, Cron 설정, 백업 검증, 클라우드 업로드",Medium,3,인프라 & 배포,DevOps Agent,backup,Sprint 4,To Do,Infrastructure
Task,백업 스크립트,"PostgreSQL pg_dump, 압축, 날짜별 파일명",High,2,백업 & 복구,DevOps Agent,backup-script,Sprint 4,To Do,Infrastructure
Task,Cron 설정,"매일 새벽 2시 자동 백업, 로그 기록",Medium,1,백업 & 복구,DevOps Agent,cron,Sprint 4,To Do,Infrastructure
Task,백업 검증,"복구 테스트, 백업 파일 무결성 확인",High,1,백업 & 복구,DevOps Agent,validation,Sprint 4,To Do,Infrastructure
Task,클라우드 업로드,"S3/GCS 백업 (선택), 7일치 백업 유지",Low,2,백업 & 복구,DevOps Agent,cloud-backup,Sprint 4,To Do,Infrastructure
Story,프로덕션 배포,"VPS 설정, Docker/Nginx 설치, SSL, 환경 변수, 첫 배포, DNS",High,8,인프라 & 배포,DevOps Agent,production,Sprint 5,To Do,Infrastructure
Task,VPS 서버 설정,"DigitalOcean/Vultr 가입, 서버 생성 (4GB RAM), SSH 키 등록",Highest,2,프로덕션 배포,DevOps Agent,vps,Sprint 5,To Do,Infrastructure
Task,Docker 설치,"Docker, Docker Compose 설치, sudo 권한 설정",High,1,프로덕션 배포,DevOps Agent,docker,Sprint 5,To Do,Infrastructure
Task,Nginx 설정,"리버스 프록시 설정, 정적 파일 서빙, WebSocket 프록시",High,2,프로덕션 배포,DevOps Agent,nginx,Sprint 5,To Do,Infrastructure
Task,SSL 인증서,"Certbot 설치, Let's Encrypt 인증서 발급, 자동 갱신",High,1,프로덕션 배포,DevOps Agent,ssl,Sprint 5,To Do,Infrastructure
Task,환경 변수 설정,".env.production 작성, 비밀키 생성, DB 연결 정보",High,1,프로덕션 배포,DevOps Agent,env,Sprint 5,To Do,Infrastructure
Task,첫 배포,"docker-compose -f docker-compose.prod.yml up -d, 서비스 확인",Highest,1,프로덕션 배포,DevOps Agent,deployment,Sprint 5,To Do,Infrastructure
Task,도메인 연결,"DNS A 레코드 설정, 도메인 구매 (선택)",Medium,1,프로덕션 배포,DevOps Agent,dns,Sprint 5,To Do,Infrastructure
Task,배포 문서 작성,"운영 가이드, 장애 대응, 롤백 절차",Medium,2,프로덕션 배포,DevOps Agent,documentation,Sprint 5,To Do,Infrastructure
Story,백엔드 테스트,"단위 테스트, 통합 테스트, 커버리지 80%, E2E 주문 플로우",High,8,테스트 & 품질 관리,QA/Testing Agent,testing;backend,Sprint 4,To Do,QA
Task,단위 테스트 작성,"pytest로 핵심 로직 테스트, Mocking, Fixture",High,5,백엔드 테스트,QA/Testing Agent,unit-test,Sprint 4,To Do,QA
Task,통합 테스트,"API 엔드포인트 테스트, TestClient, DB 트랜잭션 롤백",High,4,백엔드 테스트,QA/Testing Agent,integration-test,Sprint 4,To Do,QA
Task,테스트 커버리지 측정,"pytest-cov로 80% 목표, 커버리지 리포트 생성",Medium,2,백엔드 테스트,QA/Testing Agent,coverage,Sprint 4,To Do,QA
Task,주문 플로우 테스트,"E2E 시나리오 (주문 생성 → 체결 → 포지션 업데이트)",High,3,백엔드 테스트,QA/Testing Agent,e2e,Sprint 4,To Do,QA
Story,프론트엔드 테스트,"컴포넌트 테스트, 통합 테스트, E2E (선택)",Medium,5,테스트 & 품질 관리,QA/Testing Agent,testing;frontend,Sprint 5,To Do,QA
Task,컴포넌트 테스트,"Jest + React Testing Library, 주요 컴포넌트 테스트",Medium,3,프론트엔드 테스트,QA/Testing Agent,component-test,Sprint 5,To Do,QA
Task,통합 테스트,"주요 플로우 테스트 (로그인, 주문), MSW로 API 모킹",Medium,3,프론트엔드 테스트,QA/Testing Agent,integration-test,Sprint 5,To Do,QA
Task,E2E 테스트,"Playwright/Cypress로 전체 플로우 테스트 (선택)",Low,4,프론트엔드 테스트,QA/Testing Agent,e2e,Sprint 5,To Do,QA
